{
  "schema_version": "1.0",
  "source": "illustrative_example_edited_by_user",
  "generated_at": "2026-10-10T08:00:00Z",
  "items": [
    {
      "type": "food",
      "id": "example_chicken_01",
      "name": "Example cooked chicken breast",
      "aliases": [],
      "brand": null,
      "origin": null,
      "food_state": "cooked",
      "basis": "per_100g",
      "serving_g": null,
      "reference_url": null,
      "confidence": "estimated",
      "nutrients": {
        "energy_kcal": 165,
        "protein_g": 31,
        "carbohydrates_g": 0,
        "sugars_g": 0,
        "fiber_g": 0,
        "fat_total_g": 3.6,
        "fat_saturated_g": 1.0,
        "fat_monounsaturated_g": null,
        "fat_polyunsaturated_g": null,
        "fat_trans_g": null,
        "cholesterol_mg": null,
        "starch_g": null,
        "sugars_added_g": null,
        "omega_3_ala_g": null,
        "omega_3_epa_mg": null,
        "omega_3_dha_mg": null,
        "omega_6_linoleic_g": null,
        "vitamin_a_rae_ug": null,
        "vitamin_b1_thiamin_mg": null,
        "vitamin_b2_riboflavin_mg": null,
        "vitamin_b3_niacin_mg": null,
        "vitamin_b5_pantothenic_acid_mg": null,
        "vitamin_b6_mg": null,
        "vitamin_b7_biotin_ug": null,
        "vitamin_b9_folate_dfe_ug": null,
        "vitamin_b9_folate_total_ug": null,
        "vitamin_b12_ug": null,
        "vitamin_c_mg": null,
        "vitamin_d_ug": null,
        "vitamin_e_alpha_tocopherol_mg": null,
        "vitamin_k_ug": null,
        "calcium_mg": null,
        "chloride_mg": null,
        "chromium_ug": null,
        "copper_mg": null,
        "fluoride_mg": null,
        "iodine_ug": null,
        "iron_mg": null,
        "magnesium_mg": null,
        "manganese_mg": null,
        "molybdenum_ug": null,
        "phosphorus_mg": null,
        "potassium_mg": null,
        "selenium_ug": null,
        "sodium_mg": null,
        "zinc_mg": null,
        "choline_mg": null
      }
    },
    {
      "type": "food",
      "id": "example_rice_01",
      "name": "Example cooked white rice",
      "aliases": [],
      "brand": null,
      "origin": null,
      "food_state": "cooked",
      "basis": "per_100g",
      "serving_g": null,
      "reference_url": null,
      "confidence": "estimated",
      "nutrients": {
        "energy_kcal": 130,
        "protein_g": 2.7,
        "carbohydrates_g": 28.0,
        "sugars_g": 0.1,
        "fiber_g": 0.4,
        "fat_total_g": 0.3,
        "fat_saturated_g": 0.1,
        "fat_monounsaturated_g": null,
        "fat_polyunsaturated_g": null,
        "fat_trans_g": null,
        "cholesterol_mg": null,
        "starch_g": null,
        "sugars_added_g": null,
        "omega_3_ala_g": null,
        "omega_3_epa_mg": null,
        "omega_3_dha_mg": null,
        "omega_6_linoleic_g": null,
        "vitamin_a_rae_ug": null,
        "vitamin_b1_thiamin_mg": null,
        "vitamin_b2_riboflavin_mg": null,
        "vitamin_b3_niacin_mg": null,
        "vitamin_b5_pantothenic_acid_mg": null,
        "vitamin_b6_mg": null,
        "vitamin_b7_biotin_ug": null,
        "vitamin_b9_folate_dfe_ug": null,
        "vitamin_b9_folate_total_ug": null,
        "vitamin_b12_ug": null,
        "vitamin_c_mg": null,
        "vitamin_d_ug": null,
        "vitamin_e_alpha_tocopherol_mg": null,
        "vitamin_k_ug": null,
        "calcium_mg": null,
        "chloride_mg": null,
        "chromium_ug": null,
        "copper_mg": null,
        "fluoride_mg": null,
        "iodine_ug": null,
        "iron_mg": null,
        "magnesium_mg": null,
        "manganese_mg": null,
        "molybdenum_ug": null,
        "phosphorus_mg": null,
        "potassium_mg": null,
        "selenium_ug": null,
        "sodium_mg": null,
        "zinc_mg": null,
        "choline_mg": null
      }
    },
    {
      "type": "recipe",
      "id": "example_chicken_rice_bowl",
      "name": "Example chicken and rice bowl",
      "ingredients": [
        {
          "ref_id": "example_chicken_01",
          "quantity_g": 180
        },
        {
          "ref_id": "example_rice_01",
          "quantity_g": 200
        }
      ],
      "cooked_yield_g": 380,
      "servings": 1,
      "notes": "Illustrative values, not sourced nutritional database figures."
    },
    {
      "type": "diary_entry",
      "id": "example_meal_01",
      "ref_id": "example_chicken_rice_bowl",
      "logged_at": "2026-10-10T12:30:00+08:00",
      "quantity_g": 380,
      "meal": "lunch",
      "note": null
    }
  ]
}
